,video_id,comments
383,b7AYbpM5YrE,"['Thank you Striver, understood', 'Thank you sir😊, you made this topic crystal clear.', 'I solved this iam happy', 'Understood', 'Nice explanation 🙂🙂🙏', 'Understood......Thank You So Much for this wonderful video.....🙏🏻🙏🏻🙏🏻', 'name of the song used int he outro', 'UNDERSTOOD', 'One of the interesting approach I have come to know, thanks striver.', 'Thank you Bhaiya']"
384,nv7F4PiLUzo,"['Please watch our new video on the same topic: https://www.youtube.com/watch?v=D1oDwWCq50g', 'you just need to find kth smallest number all in all. It might seem complicated but it basically is to ensure that th elements are smaller than leftover not chosen elements and we dont compare it with its own array because that particular array is sorted so just need to keep a check of the array for a particular element.', 'jai jinendra sir', 'Boring like hell', '😀', 'so well explained!!!!!', 'Other than the edge cases, I was able to code this one on my own. Most optimised approach, maza agya', 'Understood 💯💯💯', ""Hello Striver! I'm Smeet. This code will fail in test cases where k - m > m. Why? Because the low will be initialized greater than high, resulting in skiping the execution of while loop.\n\nHence, the correct initialization should be :\nint low = max(0 , min(k - m , m));\n\nThis will take care of the test cases. \n\nAnd Thank you so much for this valuable content."", 'Understood 👍 The way you explained edge cases exemplifies your proficiency. Great work as always..']"
385,NTop3VTjmxk,"['Do write ""understood"" if you understood, motivates me :) \n\nA common question, why take first smaller array, because the complexity of bs is search space, so the smaller the search space, smaller the complexity. You can take the larger array, but the search space will be bigger. \n\nInsta: https://www.instagram.com/striver_79/\u200b\nTelegram: http://bit.ly/tuftelegram\u200b', 'Fantastic explanation!', 'Understood', 'At the start of the video , i thought it is very difficult to understand. But the video went on, the whole things got cleared. \n#Thank you #Striver', 'pls tell me if we use (n1+n2)/2 we just have to change median as min(r1,r2) t doesnot create an differrence right?', 'Hello, i did not understood the part where you are taking n1+n2+1, why +1? and how its working for both even and odd cases. Question 2: in basic binary search we are taking high as array size -1 but here you have taken array size why this is needed?', 'Took a while but got it!😀', 'Ek number!👍', 'Thanks a lot! The best video explaining this problem', 'Nice explanation']"
386,r3pMQ8-Ad5s,"['Please watch our new video on the same topic: https://www.youtube.com/watch?v=5qGrJbHhqFs', 'understood', 'in first inequality check why are we checking a[low]<=a[mid] and why not a[low]<a[mid]? I tried the latter but getting the wrong answer, please explain the intuition.', 'I have watched multiple videos but this one has the clear explanation than all the others. thank you!!', 'Just want to say Thanksss Man!!!!', 'If we have duplicates like\n7 4\n3 3 3 3 4 3 3\nNeither left nor right side is sorted', 'Understood 💯💯💯', ""@takeUforward I don't know how so many people have understood and submitted it. But the code is not giving the correct output for the input array  A:[2,20,10,8] and target integer B=8. It is giving -1 but we all know answer should be 3. please help me anyone"", ""can't we just fi d the peak element and then perform BS on two subarrays."", 'Is O(n log n) better than O(n)?']"
387,PzszoiY5XMQ,"['Do write ""understood"" if you understood, motivates me :) \n\nInsta: https://www.instagram.com/striver_79/\u200b\nTelegram: http://bit.ly/tuftelegram\u200b', 'Like if the operation if(arr[mid]==arr[mid^1]) is not true, it means that there has been disturbance before which makes it false and hence we check the left side else we check further', 'Impressed by the right shift operator you have applied!! and the observation is marvellous!!!', 'Thank you !! Understood', 'That trick of xor to avoid multiple if condition is just mind blowing', 'Understood 💯💯💯', ""Didn't understand"", 'Taking h=n-1 also works as for the case last element is answer mid will also point to it , since its ans  arr[mid]=arr[mid^1]\nwill not work and hence we will break out of loop.\nreturn arr[l]', 'seems to be confusing explanation somewhat.', 'understood...................May god bless you ❤\nkeep going']"
388,63fPPOdIr2c,"['Follow me at Instagram: https://www.instagram.com/striver_79/\u200b \nJoin our telegram group: https://t.me/Competitive_Programming_tuf', 'what is the answer we get is not there in the matrix', 'Understood', 'bhai tu approach batate time hyper q ho jata hai, aaram se ek flow me bola kar , english utni achi nhi hai teri jo fluent bol v nhi pata upar se complex kar deta hai explanation ko v', 'One Solution with O(n/2) (Not Binary Search) - Javascript\n\nconst matrixMedian = (matrix, n, m) => {\r\n    \r\n    const median = Math.ceil((m*n)/2)\r\n\r\n    let count = 0;\r\n    \r\n    let colPointer = new Array(5).fill(0)\r\n    let rowIndex;\r\n    while(count !== median){\r\n        rowIndex = min(matrix, n , colPointer)\r\n        count ++;\r\n    }\r\n    console.log(rowIndex)\r\n    return matrix[rowIndex][colPointer[rowIndex]-1]\r\n\r\n}\r\n\r\nconst min = (matrix, n, colPointer) => {\r\n    let mininum = 1e9;\r\n    let minRow = -1;\r\n\r\n    for(let row = 0; row< n; row++ ){\r\n        if(matrix[row][colPointer[row]] < mininum){\r\n            mininum = matrix[row][colPointer[row]]\r\n            minRow = row;\r\n        }\r\n    }\r\n    colPointer[minRow] = colPointer[minRow]+1;\r\n    return minRow; \r\n}', 'If someone comes up with this solution in an interview, hats off to them!', 'now , i am more confused', 'very confusing \nother videos are good explained but this just goes over the head', 'Awesome explanation. Thanks for the amazing video.', 'not clear :(\nplease rerecord this video']"
389,WjpswYrS2nY,"['Instead of multiplying by running a for loop, we can use Binary Exponentiation technique to do in log N. Video: https://www.youtube.com/watch?v=l0YC3876qxg', 'understood', ""In time complexity from 1 to say 27 there aren't 10*27 real numbers for upto 1 decimal place. 1.0 1.1 1.2 .... 1.9 (10 nos) 2.0 2.1 ... 2.9 (10 nos) ... 26.0 26.1...26.9 (10 nos) total nos till now =  10*26. And one more number 27.0 which makes the total real numbers from 1 to 27 equal to 10*26 + 1 => (M-1)*10 + 1? If no please explain."", 'Understood 💯💯💯', 'US', ""My this code require less no of calculations because whenever I found the number I am going to return it\nAnd in your code if  'l'  pointer is on the ans then your *r* first approach to the pointer then it will leave the while loop and again calculate the ans then it will return \n\nint NthRoot(int n, int m) {\r\n  // Write your code here.\r\n  int l=1,r=m;\r\n  while(l<=r)\r\n  {\r\n    \r\n    int mid=(l+r)/2;\r\n    // cout<<mid<<endl;\r\n    if(pow(mid,n)==m)\r\n    {\r\n      return mid;\r\n    }\r\n    else if(pow(mid,n)>m)\r\n    {\r\n      r=mid-1;\r\n    } \r\n    else\r\n    {\r\n      l=mid+1;\r\n    }\r\n  }\r\n\r\n  return -1;\r\n}"", 'thanks bhai striver', 'very good video', 'u r so dedicated man i wanna be also that much', 'DP series is helpul. Somehow the code not passing all the test cases in gfg. So adding a working code. That might be helpful\nclass Solution:\n    def NthRoot(self, n, m):\n        # Code here\n        if m == 1:\n            return 1\n        if n==0:\n            return 1\n        if n==1:\n            return m\n        start = 0\n        end = m//2\n        \n        while start<=end:\n            mid = start+(end-start)//2\n            num = 1\n            for i in range(n):\n                num = mid*num\n            if num == m:\n                return mid\n            elif num<m:\n                \n                start = mid+1\n            else:\n                end = mid-1\n        return -1']"
390,bLGZhJlt4y0,"['✅ Instagram: https://www.instagram.com/striver_79/\u200b\n\nPlease like and leave a comment if you understand, a comments means a lot to me :)', 'You can also do this without taking any extra matrix ""visited"", You can change the given ""mat"" matrix coordinate to 0 (as blocked), the path that the rat came from. By this, it will never check the path you came from and the TC will be O(3^(N^2)).\nCode 👇👇\n\nclass Solution {\n  public:\n    void solve(int row, int col, string path, vector<string> &ans, vector<vector<int>> mat) {\n        int n = mat.size();\n        if(row==n-1 && col == n-1) {\n            ans.push_back(path);\n            return;\n        }\n        if(row<n-1&&mat[row+1][col] == 1) {\n            mat[row][col] = 0;\n            solve(row+1, col,path + \'D\', ans, mat);\n            mat[row][col] = 1;\n        }\n        if(row>0&&mat[row-1][col] == 1) {\n            mat[row][col] = 0;\n            solve(row-1, col,path + \'U\', ans, mat);\n            mat[row][col] = 1;\n        }\n        if(col<n-1&&mat[row][col+1] == 1) {\n            mat[row][col] = 0;\n            solve(row, col+1,path + \'R\', ans, mat);\n            mat[row][col] = 1;\n        }\n        if(col>0&&mat[row][col-1] == 1) {\n            mat[row][col] = 0;\n            solve(row, col-1,path + \'L\', ans, mat);\n            mat[row][col] = 1;\n        }\n    }\n    vector<string> findPath(vector<vector<int>> &mat) {\n        // Your code goes here\n        vector<string> ans;\n        int n = mat.size();\n        //Rat can\'t enter if the entrance is blocked\n        if(mat[0][0] == 1 && mat[n - 1][n - 1] == 1) solve(0, 0, """", ans, mat);\n        return ans;\n    }\n};', 'Understood', 'Understood 😊', 'You are a true gem the way you explain❤❤', 'why did we not mark the final element in vis at (n-1, n-1).', 'This  "" vis[0][0] =1 "" should be done before calling the solve function. Otherwise  compiler will come at (0,0) index again ,and that cause wrong output.  Testcase for the above case is\nn=2\n{{1,1},{1,1}}.\nIn for loop approach.', 'Please also write the code in java , because  some developers are write  in java language so please code in java  as well', 'next level explanation...', 'Thank you striver for this great recursion  series as now because  of you only I can now able to build logic of my own. In this video also after watching the problem in first few minutes, I can able to solve the problem. Thank you...']"
391,wuVwUK25Rfc,"['✅ Instagram: https://www.instagram.com/striver_79/\u200b\n\nPlease comment if you understand, a comments means a lot to me :)', 'c++ 20:58', ""I haven't learned about graph yet"", 'Hi All, I was really confused between M coloring problem and bi partite graph problem. The Bi partite graph problem uses DFS/BFS for checking if no 2 adjacent nodes are filled with the same color(2 colors). So I was wondering if we could use DFS/BFS here as well. Turns out no, as in the GFG practice problem, in one TC. we have disconnected nodes as well in the graph and this cant be covered with DFS/BFS. Please let me know if my understanding is correct.', '😍😍😍😍', 'understood ', 'again solved on my own even without the explanation... i think im getting better : "")', 'Thanks brother. Understood', 'One more optimization,if m>=4 then it is always possible to colour a graph by 4 colour theorem. So if m>=4 return true.', 'The best what you get \ni have done the recursion and backtracking from another paid courser but it is not worth it \nbut the striver recursion playlist is bast of class\ni have done all recursion from 1 to last and now the recursion feel like game not very easy but so far so good']"
392,FWAIf_EVUKE,"['Instagram for live updates about channel and live sessions: striver_79', '17:59', '12:49', 'can someone explain time complexity and space complexity?', 'Is there any optimised solution for this? Incase the interviewer asks.', 'Tere bhai bhai jaisa koi hardich nai h', 'Solve it without watching the solution .', 'awesome explanation', ""SOLVED THIS WITHOUT WATCHING THE VIDEO AND I FEEL THIS IS MY GREATEST ACHIEVEMENT. THANKSS STRIVERR.\r\n\r\nmy solution is a lil different and maybe simpler (might not be too, cuz i didnt read the code in video)\r\nCheck it down below:\r\n\r\nclass Solution {\r\npublic:\r\n    bool solver(int pos, int &n, vector<vector<char>> &board,\r\n    vector<vector<bool>> &inRow,\r\n    vector<vector<bool>> &inCol,\r\n    vector<vector<bool>> &inBox){\r\n        if(pos >= n ){\r\n            return true;\r\n        }\r\n\r\n        int row= pos/9;\r\n        int col= pos%9;\r\n        while( pos<n && board[row][col] >= '1' && board[row][col] <= '9'){\r\n            pos++;\r\n            row= pos/9;\r\n            col= pos%9;\r\n        }\r\n        if(pos==n) return true;\r\n\r\n        //if . is found, then try every single number\r\n        for(int num=1; num<=9; ++num){\r\n            int boxInd= (row/3) * 3 + (col/3);\r\n\r\n            //check if its safe to place\r\n            if( !inRow[row][num] && !inCol[col][num] && !inBox[boxInd][num] ){\r\n\r\n                //place this number in this position\r\n                inRow[row][num] = inCol[col][num] = inBox[boxInd][num] =true;\r\n                board[row][col] =num + '0';\r\n\r\n                if (solver(pos+1, n, board, inRow, inCol, inBox)) return true;\r\n                \r\n                //remove it since it wasnt the correct position\r\n                inRow[row][num] = inCol[col][num] = inBox[boxInd][num] =false;\r\n                board[row][col] ='.';\r\n            }\r\n        }\r\n        return false;\r\n    }\r\n    void solveSudoku(vector<vector<char>>& board) {\r\n        //declare the number presence check vectors\r\n        //each have 9 rows to rep which row/col/box and 10 cols (ignoring 0) for each number\r\n        vector<vector<bool>> inRow(9, vector<bool> (10));\r\n        vector<vector<bool>> inCol(9, vector<bool> (10));\r\n        vector<vector<bool>> inBox(9, vector<bool> (10));\r\n\r\n        //initialise the presence checkers by running it through the board once\r\n        for(int i=0; i<9; ++i){\r\n            for(int j=0; j<9; ++j){\r\n                if(board[i][j] == '.') continue;\r\n                else{\r\n                    int boxInd= (i/3)*3 + j/3; //box representation\r\n                    int num= board[i][j] - '0';\r\n\r\n                    inRow[i][num] = true;\r\n                    inCol[j][num] = true;\r\n                    inBox[boxInd][num] = true;\r\n                }\r\n            }\r\n        }\r\n\r\n        int startPos= 0;\r\n        int endPos= 81;\r\n        solver(startPos, endPos, board, inRow, inCol, inBox);\r\n    }\r\n};"", 'Note: We don\'t need to write ""Else"". This is because in the if condition, we are anyways ""return""ing']"
393,i05Ju7AftcM,"['Instagram for live updates about channel and live sessions: striver_79', 'bruh my frnd is a noob in programming but after seeing your explanation, he is saying that coding is so easy... you make lives beautiful dude', 'Thankss', 'our teacher taught this as if it were a problem about theory of relativity and you taught it like the alphabet. thank you so much', 'Thanks!', '✅', 'Striver I am from West Bengal. You are god of problem solving!! ❤❤❤❤❤❤', 'Amazing Striver 😊😊', 'thank you sir for this amazing solution.', 'understood ']"
394,V8qIqJxCioo,"['I will be posting a video every Sunday on the other channel, so bell DABAAAAA dena: https://www.youtube.com/channel/UCvEKHATlVq84hm1jduTYm8g', 'We can skip the step 2 that is transposing the graph, as it will take o(N+E) space. Use vis & an array. do step 1 (perform topo sort, store all nodes in time array in desc order of finishing time). do step 3. (run a loop on time array &  perfrom dfs one by one for all nodes in desc time order). YOU ARE DONE. space is o(N) now. you skipped step 2.', 'Very very helpful vdeoo', ""isn't topological sort used for acyclic graphs"", ""why can't we use queue to store toposort and avoid that step transposing the graph?"", 'Sir I am bit confused, in topo Sort video, we had learnt that for topo sort to be done it must be directed acyclic but in the first example you told, there is a cycle present na', 'Sir topo sort also take O(V+E) time', 'Background Me Plane Ud Rha h\n', 'Yeah', 'dne : 11:17']"
395,75yC1vbS8S8,"['I will be posting a video every Sunday on the other channel, so bell DABAAAAA dena: https://www.youtube.com/channel/UCvEKHATlVq84hm1jduTYm8g', 'very understand for me, thx u <3', 'thx', 'Finally completed Graph series...Thank you Striver for such quality content\n30/09/2022', 'When storing 1000000 in the distance vector the code is working but when storing INT_MAX in distance vector the code is not working.\r\n\r\nWhy??', 'Thanks :)', 'Completed this series today, Feeling much more confident on graphs. Thank you Bhaiya :)', '💖', 'This dude is a genious 👌👌👌', 'why do I get wrong output if I keep infinity as INT_MAX?']"
396,2rjZH0-2lhk,"['I will be posting a video every Sunday on the other channel, so bell DABAAAAA dena: https://www.youtube.com/channel/UCvEKHATlVq84hm1jduTYm8g', 'Folks one simple thing coming in my mind is why cant i check the bridge using in degree and out degree for each node if it is one then that edge will be the bridge right ?????', 'Link to this playlist ?', 'Thanks for the smooth explanation & clean code', 'Initially I find this problem very difficult, I spended almost 3-4 hours and keep  watching videos and understand the code.\n\nPlease watch the whole video 3-4 times. It will become easy for you.', 'crystal clear', ""Don't make videos just for the sake  of making videos, Time waste"", 'I like how he keeps all traversed nodes in his brain memory', ""For people who are finding this difficult follow these steps:-\n1) Watch: Types of edges from Jenny's Lectures YouTube channel\n2) Watch: Finding all bridges in a graph from Jenny's Lectures."", 'For Child & parent , logic for update lowest insertion time is Low(parent)=min(Low(parent),Low(child))  and in other situation of back edge Low(node)=min(tin(adjacentNode),Low(node))  and for checking a bridge low(adjacentNode) > tin(node)']"
397,3t3JHswP7mw,"['I will be posting a video every Sunday on the other channel, so bell DABAAAAA dena: https://www.youtube.com/channel/UCvEKHATlVq84hm1jduTYm8g', 'A small correction: low[node] should be updated by min(low[node], low[it]), not tin[it].\nLine 22, time: 20:50', 'There is slight error in the code.\nA child++ statement must be added before calling dfs  at line 13.\nTime stamp 23:55', 'why the point of bridges can not be the articulation points', 'samajhne me thoda time laga qki child wala part dry run me nhi bataya tha but still I understood it after few efforts. At last Thankyou so much,it helped alot...', 'Can anyone share question link', 'Very nice explanation', '✅Done', ""I'm submitting the same code after watching this video in gfg-question( articulation point-1) but, it is showing wrong answer on test case 159-as i think in this case , it is taking parallel edges, what to do now"", 'Understood! Wonderful explanation as always, thank you very much!!']"
398,oNTsS8lGDHw,"[""If you are going to practice this question at GFG, the test cases are faulty there. I have attached a code for GFG's practice section in the description and have also told why is the practice section faulty.\n\nApart from this do consider following my new channel: https://www.youtube.com/channel/UCvEKHATlVq84hm1jduTYm8g"", 'A fully connected graph can have O(n^2) edges and we are going over ever edge once. How the time complexity is O(nlogn)?', 'what is the use of ""mini"" and why is the need to update it on line 36 ;   on 1:56', '#include<bits/stdc++.h>\r\nusing namespace std;\r\n\r\nint main(){\r\n\tint N=5,m=6;\r\n\tvector<pair<int,int> > adj[N]; \r\n\r\n\r\n\tadj[0].push_back({1,2});\r\n\tadj[0].push_back({3,6});\r\n\tadj[1].push_back({0,2});\r\n\tadj[1].push_back({2,3});\r\n\tadj[1].push_back({3,8});\r\n\tadj[1].push_back({4,5});\r\n\tadj[2].push_back({1,3});\r\n\tadj[2].push_back({4,7});\r\n\tadj[3].push_back({0,6});\r\n\tadj[3].push_back({1,8});\r\n\tadj[4].push_back({1,5});\r\n\tadj[4].push_back({2,7});\r\n\t\r\n    int parent[N];\r\n    int key[N]; \r\n    bool mstSet[N]; \r\n  \r\n    for (int i = 0; i < N; i++) \r\n        key[i] = INT_MAX, mstSet[i] = false; \r\n    key[0] = 0; \r\n    parent[0] = -1; \r\n    int ansWeight = 0;\r\n    for (int count = 0; count < N - 1; count++)\r\n    { \r\n        \r\n        int mini = INT_MAX, u; \r\n  \r\n        for (int v = 0; v < N; v++) \r\n{\r\n            if (mstSet[v] == false && key[v] < mini) \r\n                mini = key[v], u = v; \r\n}\r\n                 mstSet[u] = true; \r\n        \r\n        for (auto it : adj[u]) {\r\n            int v = it.first;\r\n            int weight = it.second;\r\n            if (mstSet[v] == false && weight < key[v]) \r\n                parent[v] = u, key[v] = weight; \r\n        }\r\n            \r\n    } \r\n    \r\n    \r\n    for (int i = 1; i < N; i++) \r\n        cout << parent[i] << "" - "" << i <<"" \\n""; \r\n\treturn 0;\r\n}', 'do we have to first update value of cost in key array?', 'Explanation is top notch', 'Sir , i Think instead of the loop from  count = 0 to count < v-1  we can , do while !pq.empty()', ""Python solution for Prim's Algorithm:\r\n\nimport heapq\r\nimport sys\r\nclass Solution:\r\n   \r\n   def spanningTree(self, V, adj):\r\n       \r\n       mst = [0]*V\r\n       keys = [sys.maxsize]*V\r\n       parent = [-1]*V\r\n       \r\n       keys[0] = 0\r\n       H = [[keys[0],0]]         # list(list(dis,index))\r\n       heapq.heapify(H)\r\n       \r\n       # keeps running until H is empty       \r\n       while H: \r\n           \r\n           u = heapq.heappop(H)[1] \r\n           mst[u] = 1 \r\n                  \r\n           for node,dis in adj[u]:\n\r\n               if mst[node] == 0 and dis < keys[node]:  \r\n                   parent[node] = u                     \r\n                   keys[node] = dis\r\n                   heapq.heappush(H, [keys[node], node])    \r\n                   \r\n       return sum(keys)\n\nTime complexity - O(V*log(V))\nSpace complexity - O(V)"", '✅Done', 'Instead of priority_queue, can we use ""set"", it works o(logn) for insert & erase ?']"
